{
  "version": "aiei/1.0.0",
  "id": "01961a30-2e4f-7a1b-c5d2-8e3f6a7b9c0d",
  "timestamp": "2026-03-04T14:23:45.102Z",
  "who": {
    "org_id": "org_acme_ai",
    "customer_id": "cust_initech_llc",
    "user_id": "user_peter_gibbons",
    "service_id": "svc_smart_search",
    "feature": "smart-search",
    "session_id": "sess_2d4f6a8b",
    "environment": "production"
  },
  "what": {
    "provider": "openai",
    "model": "gpt-4o-mini",
    "model_class": "efficient",
    "tokens_in": 12400,
    "tokens_out": 3200,
    "cost_usd": 0.0038,
    "latency_ms": 892,
    "request_type": "chat"
  },
  "worth": {
    "customer_revenue_monthly": 49.00,
    "customer_plan": "starter",
    "margin_current": -0.2238,
    "margin_after": -0.2315,
    "cost_to_serve_cumulative": 63.40,
    "underwater": true
  },
  "rules": {
    "budget_id": "budget_initech_q1",
    "budget_remaining_usd": -14.40,
    "budget_utilization": 1.294,
    "margin_floor": 0.40,
    "model_was_downgraded": true,
    "original_model": "gpt-4o",
    "compliance_class": "standard",
    "pii_detected": true,
    "actions_taken": ["model-downgrade", "alert-fired"]
  },
  "proof": {
    "hash": "2b4c6d8e0f2a4b6c8d0e2f4a6b8c0d2e4f6a8b0c2d4e6f8a0b2c4d6e8f0a2b4",
    "prior_hash": "7f2a9b4e1c3d5f6a8b0c2d4e6f8a0b2c4d6e8f0a2b4c6d8e0f2a4b6c8d0e2f4",
    "signature": "hmac_4f3e2d1c0b9a8f7e6d5c4b3a2f1e0d9c8b7a6f5e4d3c2b1a0f9e8d7c6b5a4f",
    "algorithm": "sha256+hmac-sha256",
    "chain_depth": 4730,
    "sealed_at": "2026-03-04T14:23:45.147Z"
  }
}
